{
  "name": "components/progress",
  "type": "ls:component",
  "description": "Accessible progress component.",
  "files": [
    {
      "path": "registry/components/progress/progress.css",
      "type": "registry:style"
    }
  ],
  "registryDependencies": ["core/base"],
  "dependencies": [],
  "devDependencies": [],
  "docs": "registry/components/progress/README.md",
  "rootClass": "ls-progress",
  "safeAnywhere": true,
  "snippets": [
    {
      "label": "Basic progress",
      "path": "registry/components/progress/snippets/basic.html"
    }
  ],
  "authoring": {
    "classGroups": [
      {
        "base": "ls-progress",
        "elements": [
          "ls-progress__label",
          "ls-progress__value",
          "ls-progress__track",
          "ls-progress__bar"
        ]
      }
    ],
    "dataAttributes": [
      {
        "name": "data-ls-tone",
        "values": ["success", "warning", "danger"]
      },
      {
        "name": "data-ls-density",
        "values": ["compact", "spacious"]
      },
      {
        "name": "data-ls-animate",
        "values": ["fill"]
      }
    ],
    "cssVariables": ["--ls-progress-value", "--ls-progress-thickness", "--ls-progress-label-size"],
    "usage": ["Set --ls-progress-value to the fill percentage, e.g. 72%."]
  },
  "agentLevel": "recommended",
  "tags": ["progress", "status", "completion"],
  "useCases": ["Show progress, completion, migration status, or phase status."]
}
