{
  "name": "presets/themes/technical-deep",
  "type": "ls:preset",
  "description": "Precise high-contrast dark theme for engineering talks and code-heavy decks.",
  "tags": ["theme", "technical", "code", "dark"],
  "files": [
    {
      "path": "registry/presets/themes/technical-deep/theme.css",
      "type": "registry:style"
    }
  ],
  "registryDependencies": ["core/base"],
  "dependencies": [],
  "devDependencies": [],
  "docs": "registry/presets/themes/technical-deep/README.md",
  "safeAnywhere": true,
  "styleTone": "technical deep dark",
  "useCases": ["Use for dark technical, engineering, or product architecture decks."],
  "pairsWith": ["presets/fonts/technical-mono", "presets/fonts/system-humanist"],
  "themeAttribute": "technical-deep",
  "authoring": {
    "attributes": [
      {
        "name": "data-ls-theme",
        "scope": "html",
        "value": "technical-deep"
      }
    ],
    "usage": ["Apply exactly one theme per deck on the html element."]
  },
  "agentLevel": "starter"
}
