{
  "name": "templates/icon-grid",
  "type": "ls:template",
  "description": "Compact icon-tile grid template for 4-6 short items.",
  "files": [],
  "registryDependencies": ["core/base", "utilities/layout", "components/icon-item"],
  "dependencies": [],
  "devDependencies": [],
  "docs": "registry/templates/icon-grid/README.md",
  "rootClass": null,
  "safeAnywhere": false,
  "snippets": [
    {
      "label": "Icon grid slide",
      "path": "registry/templates/icon-grid/snippet.html"
    }
  ],
  "authoring": {
    "usage": [
      "Paste snippet HTML inside .ls-deck and copy its registryDependencies before use.",
      "Use .ls-grid--3 for 5-6 items and .ls-grid--2 for 4 items; keep each tile to one title and one sentence."
    ],
    "classes": [
      "ls-slide",
      "ls-slide__inner",
      "ls-slide__header",
      "ls-eyebrow",
      "ls-title",
      "ls-grid",
      "ls-grid--3",
      "ls-icon-item",
      "ls-icon-item--boxed",
      "ls-icon-item__body",
      "ls-icon-item__title",
      "ls-icon-item__text",
      "ls-icon-badge"
    ]
  },
  "composition": {
    "contentDensity": ["sparse"],
    "layoutBehavior": "content-sized",
    "itemCountGuidance": "4-6 short items; for 3 richer points use templates/three-cards, for one-liner rows use templates/feature-rows.",
    "copyGuidance": "One title plus one sentence per tile; icons carry the visual weight.",
    "avoidWhen": [
      "each item needs 2-4 sentences or a visual",
      "there are more than 6 items (split across two slides instead)"
    ],
    "alternatives": [
      { "when": "3 items with 2-4 sentences or visuals each", "use": "templates/three-cards" },
      { "when": "3-5 one-liner points that read as a list", "use": "templates/feature-rows" }
    ]
  },
  "agentLevel": "starter",
  "useCases": ["Present 4-6 short capabilities, features, or facts as compact tiles."]
}
