{
  "name": "templates/feature-rows",
  "type": "ls:template",
  "description": "Stacked full-width rows template for 3-5 one-liner points.",
  "files": [],
  "registryDependencies": ["core/base", "utilities/layout", "components/icon-item"],
  "dependencies": [],
  "devDependencies": [],
  "docs": "registry/templates/feature-rows/README.md",
  "rootClass": null,
  "safeAnywhere": false,
  "snippets": [
    {
      "label": "Feature rows slide",
      "path": "registry/templates/feature-rows/snippet.html"
    }
  ],
  "authoring": {
    "usage": [
      "Paste snippet HTML inside .ls-deck and copy its registryDependencies before use.",
      "Keep 3-5 rows with one sentence each; the single-column .ls-grid centers the block vertically."
    ],
    "classes": [
      "ls-slide",
      "ls-slide__inner",
      "ls-slide__header",
      "ls-eyebrow",
      "ls-title",
      "ls-grid",
      "ls-icon-item",
      "ls-icon-item--boxed",
      "ls-icon-item__body",
      "ls-icon-item__title",
      "ls-icon-item__text",
      "ls-icon-badge"
    ]
  },
  "composition": {
    "contentDensity": ["sparse"],
    "layoutBehavior": "content-sized",
    "itemCountGuidance": "3-5 one-liner points; for 4-6 very short items use templates/icon-grid.",
    "copyGuidance": "One keyword or short title plus one sentence per row.",
    "avoidWhen": ["points carry 2-4 sentences or visuals", "there are more than 5 rows"],
    "alternatives": [
      { "when": "3 items with 2-4 sentences or visuals each", "use": "templates/three-cards" },
      { "when": "4-6 very short items", "use": "templates/icon-grid" }
    ]
  },
  "agentLevel": "starter",
  "useCases": ["List 3-5 short principles, steps, or takeaways as full-width rows."]
}
