{
  "name": "templates/metric-dashboard",
  "type": "ls:template",
  "description": "Dashboard template for metrics and progress indicators.",
  "files": [],
  "registryDependencies": [
    "core/base",
    "utilities/layout",
    "components/metric",
    "components/progress",
    "components/panel"
  ],
  "dependencies": [],
  "devDependencies": [],
  "docs": "registry/templates/metric-dashboard/README.md",
  "rootClass": null,
  "safeAnywhere": false,
  "snippets": [
    {
      "label": "Metric dashboard slide",
      "path": "registry/templates/metric-dashboard/snippet.html"
    }
  ],
  "authoring": {
    "usage": [
      "Paste snippet HTML inside .ls-deck and copy its registryDependencies before use.",
      "Keep metric labels short; use the progress panel for one concise status indicator."
    ],
    "classes": [
      "ls-slide",
      "ls-slide__inner",
      "ls-stack",
      "ls-stack--sm",
      "ls-eyebrow",
      "ls-title",
      "ls-grid",
      "ls-grid--3",
      "ls-panel",
      "ls-metric",
      "ls-metric__value",
      "ls-metric__label",
      "ls-progress",
      "ls-progress__label",
      "ls-progress__value",
      "ls-progress__track",
      "ls-progress__bar"
    ]
  },
  "agentLevel": "recommended",
  "useCases": ["Show KPIs, progress, or measurable status."]
}
