{
  "name": "utilities/layout",
  "type": "ls:utility",
  "description": "Reusable layout utilities for stacks, clusters, grids, centering, and fill behavior.",
  "files": [
    {
      "path": "registry/utilities/layout/layout.css",
      "type": "registry:style"
    }
  ],
  "registryDependencies": ["core/base"],
  "dependencies": [],
  "devDependencies": [],
  "docs": "registry/utilities/layout/README.md",
  "rootClass": "ls-stack",
  "safeAnywhere": false,
  "snippets": [
    {
      "label": "Basic utility layouts",
      "path": "registry/utilities/layout/snippets/basic.html"
    }
  ],
  "authoring": {
    "classGroups": [
      {
        "base": "ls-stack",
        "modifiers": ["ls-stack--sm", "ls-stack--lg"],
        "rule": "Use one optional stack gap modifier."
      },
      {
        "base": "ls-grid",
        "modifiers": [
          "ls-grid--2",
          "ls-grid--3",
          "ls-grid--4",
          "ls-grid--wide-left",
          "ls-grid--wide-right"
        ],
        "rule": "Use ls-grid with at most one grid modifier."
      }
    ],
    "classes": [
      "ls-cluster",
      "ls-center",
      "ls-center-start",
      "ls-text-start",
      "ls-fill",
      "ls-slide-fill",
      "ls-frame"
    ],
    "cssVariables": [
      "--ls-stack-gap",
      "--ls-cluster-gap",
      "--ls-cluster-align",
      "--ls-grid-gap",
      "--ls-frame-min-block-size"
    ],
    "usage": [
      "Use .ls-grid--4 only for short, compact cards or metrics.",
      "Use .ls-slide-fill as a direct child of .ls-slide__inner for full-slide centered layouts.",
      "Use .ls-fill only when content should intentionally fill the available slide/body area."
    ],
    "classMetadata": {
      "ls-slide-fill": {
        "scopeType": "direct-child-of-slide-inner",
        "safeAnywhere": false,
        "description": "Full-slide layouts that intentionally span the slide header/body rows. Not for ordinary content slides."
      },
      "ls-center": {
        "scopeType": "centers-content-cluster",
        "safeAnywhere": false,
        "description": "Intentional centering only (hero/section)."
      },
      "ls-center-start": {
        "scopeType": "centers-content-cluster",
        "safeAnywhere": false,
        "description": "Intentional start-aligned centering (hero)."
      },
      "ls-fill": {
        "scopeType": "within-constrained-area",
        "safeAnywhere": false,
        "description": "Fills a height-constrained parent area."
      }
    }
  },
  "agentLevel": "recommended"
}
