{
  "name": "presets/fonts/technical-mono",
  "type": "ls:preset",
  "description": "Monospace label font role remap for technical slide decks.",
  "files": [
    {
      "path": "registry/presets/fonts/technical-mono/font.css",
      "type": "registry:style"
    }
  ],
  "registryDependencies": ["core/base"],
  "dependencies": [],
  "devDependencies": [],
  "docs": "registry/presets/fonts/technical-mono/README.md",
  "safeAnywhere": true,
  "authoring": {
    "attributes": [
      {
        "name": "data-ls-font",
        "scope": "html, body, or section",
        "value": "technical-mono"
      }
    ],
    "usage": ["Apply deck-wide on body or scope to individual sections when mixing type systems."]
  },
  "agentLevel": "advanced"
}
