{
  "name": "templates/code-plus-notes",
  "type": "ls:template",
  "description": "Code-focused slide template with explanatory notes.",
  "files": [],
  "registryDependencies": [
    "core/base",
    "utilities/layout",
    "components/code-block",
    "components/card"
  ],
  "dependencies": [],
  "devDependencies": [],
  "docs": "registry/templates/code-plus-notes/README.md",
  "rootClass": null,
  "safeAnywhere": false,
  "snippets": [
    {
      "label": "Code plus notes slide",
      "path": "registry/templates/code-plus-notes/snippet.html"
    }
  ],
  "authoring": {
    "usage": [
      "Paste snippet HTML inside .ls-deck and copy its registryDependencies before use.",
      "Keep code excerpts short; prefer dense code settings only after visual review."
    ],
    "classes": [
      "ls-slide",
      "ls-slide__inner",
      "ls-stack",
      "ls-stack--sm",
      "ls-eyebrow",
      "ls-title",
      "ls-grid",
      "ls-grid--wide-left",
      "ls-code-block",
      "ls-card",
      "ls-card__title",
      "ls-card__text",
      "ls-card__body"
    ]
  },
  "agentLevel": "recommended",
  "useCases": ["Teach or review code with adjacent explanatory notes."]
}
