{
  "name": "components/panel",
  "type": "ls:component",
  "description": "Standalone visual panel for grouped slide content.",
  "files": [
    {
      "path": "registry/components/panel/panel.css",
      "type": "registry:style"
    }
  ],
  "registryDependencies": ["core/base"],
  "dependencies": [],
  "devDependencies": [],
  "docs": "registry/components/panel/README.md",
  "rootClass": "ls-panel",
  "safeAnywhere": true,
  "snippets": [
    {
      "label": "Basic panel",
      "path": "registry/components/panel/snippets/basic.html"
    }
  ],
  "authoring": {
    "classGroups": [
      {
        "base": "ls-panel",
        "elements": ["ls-panel__title", "ls-panel__text"],
        "modifiers": [
          "ls-panel--muted",
          "ls-panel--accent",
          "ls-panel--center",
          "ls-panel--fit",
          "ls-panel--frame"
        ]
      }
    ],
    "cssVariables": [
      "--ls-panel-gap",
      "--ls-panel-padding",
      "--ls-panel-border",
      "--ls-panel-bg",
      "--ls-panel-fit-min-block-size",
      "--ls-panel-frame-min-block-size"
    ],
    "usage": [
      "Use muted/accent modifiers sparingly to create hierarchy.",
      "Use .ls-panel--fit for short text-only callouts that should not stretch to full column height.",
      "Use .ls-panel--frame for screenshots, diagrams, code, or media frames that should have visual mass."
    ]
  },
  "composition": {
    "contentDensity": ["sparse", "balanced"],
    "layoutBehavior": "content-sized",
    "copyGuidance": "Use one panel as a visual anchor or grouped block; ls-panel--frame keeps visual mass for media.",
    "avoidWhen": ["a grid of small text panels where each holds one short sentence"],
    "alternatives": [
      {
        "when": "several one-liner points",
        "use": "components/icon-item"
      }
    ]
  },
  "agentLevel": "recommended",
  "tags": ["panel", "visual", "frame"],
  "useCases": [
    "Create a visual anchor, grouped explanation, diagram frame, screenshot frame, or code frame."
  ]
}
